textDisplay,videojuego,moderationStatus,sentimiento
cuándo váis a hacer el vídeo quot 30 bugs divertidos de spiderman 2 segundo dlc quot los bugs que tiene os da para una serie completa pero un vídeo creo que es suficiente,Hi-Fi Rush,,
cuando vais a hacer los 30 detalles del nuevo spiderman br tengo muchas ganas,Hi-Fi Rush,,
sería excelente si no lo hubieran contaminado con su nefasta propaganda progresista,Hi-Fi Rush,,
podria salir en ps4,Hi-Fi Rush,,
una pregunta si compro la version deluxe en una cuenta y juego al spiderman en otra podre usar lo que le da la version deluxe en otra cuenta,Hi-Fi Rush,,
hoy día hacen los juegos para tontos que pintan todas esas grúas en la bahía de manthatan recuerdo lo difícil que era llegar en el 2 de ps2 a la estatua de la libertad y hoy día te lo dan todo mascado,Hi-Fi Rush,,
muy superior el mundo abierto de spiderman a la porquería de starfield 1000 planetas sobrios mehhh más de lo mismo xd,Hi-Fi Rush,,
que mal que tenga el lenguaje exclusivo pero nada que hacerle voy a tener que jugarlo,Hi-Fi Rush,,
esparare un par de meses a que baje a mitad de precio,Hi-Fi Rush,,
insomniac va a inaugurar el universo de marvel videojueguil con spiderman wolverine ya veremos que hay en el futuro,Hi-Fi Rush,,
excelente analisis pongame 2 juegos para llevar mi buen hombre,Hi-Fi Rush,,
el calvo esta echando espuma por la boca jajajajaja,Hi-Fi Rush,,
nocedicepizzataguercedicepizzatower,Hi-Fi Rush,,
los bugs están divertidísimos pero hubieran retrasado el lanzamiento para pulir esos detalles una lástima,Hi-Fi Rush,,
nota merecida,Hi-Fi Rush,,
playstation 6 la videoconsola sale en el año 2028 ir ahorrando dinero,Hi-Fi Rush,,
no me mola muy plasticada,Hi-Fi Rush,,
la moda absurda de hoy en día que cada vez que se dice sale sida de decir spaiderman en lugar de spiderman,Hi-Fi Rush,,
más de lo mismo aquel que no va al día con el mundo de los videojuegos podría confundir este título con el primero por momentos y ya estoy viendo a los niños ratas con poco pensamiento crítico no zabez nada de bidejuegozz no niñato jamás dije que fuera malo lo voy a jugar y seguramente lo voy a disfrutar pero eso no le quita lo que ya dije es más de lo mismo,Hi-Fi Rush,,
tremendo pelijuego,Hi-Fi Rush,,
como carajo tiene menos nota que mario wonder,Hi-Fi Rush,,
insomniac está que se sale aprende ubisoft,Hi-Fi Rush,,
hola,Hi-Fi Rush,,
los sonyers fumándose las ideas de una feminista progre enhorabuena por jugar a tal mierda inclusiva yo disfrutaré del mario wonder sin ideas políticas de pedos,Hi-Fi Rush,,
yo espero que el sentido arácnido respeten que cuando te toque enfrentarte a venon que peter parker no detecte a venon mientras que miles molares sí ya que recordemos que peter parker al tener el primero el simbionte el simbionte aprende a anular el sentido arácnido de peter al menos en los comics y dibujos animados de spiderman,Hi-Fi Rush,,
juego para gays,Hi-Fi Rush,,
que lastima lo del sigilo yo esperaba que la mejoren al estilo arkham es el punto flojo de la jugabilidad,Hi-Fi Rush,,
harry es venom y alfinal no matais a golpes entre peter y miles pero es una cinematica de 5 minutos para pedirte que pulse alfinal l2 y cuadrado y tu tienes el poder del antivenom igual que venom pero en blanco vamos,Hi-Fi Rush,,
todo bien le periodistes,Hi-Fi Rush,,
y el hombre de pero,Hi-Fi Rush,,
cuando se podrá canjear el código del juego que viene en la consola no deja,Hi-Fi Rush,,
cuando se podrá canjear el código del juego que viene en la consola no deja,Hi-Fi Rush,,
quot el mejore videojuege de súpere héroes quot br br es una mierda el juego,Hi-Fi Rush,,
cómo es que tú ya lo puedes jugar,Hi-Fi Rush,,
b 15 horas jajajajaja b,Hi-Fi Rush,,
a href https www youtube com watch v zf2rd1t5bk amp t 10m44s 10 44 a,Hi-Fi Rush,,
el que juega es manquisimo como es eso posible,Hi-Fi Rush,,
si merece la pena es el mejor juego del año su historia es brutal el zelda si q tiene un rival muy duro porq ambos son buenos pero spiderman me gusta más,Hi-Fi Rush,,
el viernes me lanzo a la tienda por spiderman 2,Hi-Fi Rush,,
me gusto la parte donde señala a le doctore xd,Hi-Fi Rush,,
rayos sinceramente pensé que en duración iba a ser lo doble del primer juego no de 17 a 25 horas,Hi-Fi Rush,,
amigo llevaba años esperando algún youtuber nuevo que haga los videos con la calidad y dedicación que le pones 10 10 amigo,Hi-Fi Rush,,
no entiendo como a la gente le puede gustar spiderman el juego literlamente dmc devil may cry 3 le gana y eso que salio hace bastante tiempo los juegos de spiderman son una pija,Hi-Fi Rush,,
es lo rico de tener una ps5 y una pc se disfruta de todo sin quejarse,Hi-Fi Rush,,
que lo saquen para pc,Hi-Fi Rush,,
hay más enemigos aparte de los enemigos de kraven porque noto que estamos chetaisimos,Hi-Fi Rush,,
toda la prensa comprada,Hi-Fi Rush,,
a href https www youtube com watch v zf2rd1t5bk amp t 3m39s 3 39 a genial volvio el perk de quot veneno residual quot si añadieron quot sensores de amenaza quot quot malla de inducción quot y quot impulso de venom quot entonces voy a estar demasiado roto usando a miles morales,Hi-Fi Rush,,
basura de juego play station esta muerta y ustedes lo sabeis,Hi-Fi Rush,,
habeis dicho lo de que es el mejor juego de superheroes de la historia br la premisa de sony era la misma para videos y prensa escrita br br animo que vienen las vacas flacas,Hi-Fi Rush,,
juegazo,Hi-Fi Rush,,
esta grabado en nivel facil no lo digo por el combate con el lagarto que se ve demasiado easy,Hi-Fi Rush,,
bueno siendo coherente con el 5 8 de starfield este es un 2 2,Hi-Fi Rush,,
entonces ya a salido,Hi-Fi Rush,,
hack amp slash generico simplon corto y woke hasta el vomito br todo lo que puede dar sony hasta dentro de dos años br calamidad total,Hi-Fi Rush,,
batallas brillantes vs jefes br se carga al lagarto solo con combos xd,Hi-Fi Rush,,
se ve tan hermoso como el primer juego el miles morales nunca sucedió y no me gusta que haya tantos iconos en pantalla sin importar el juego que sea,Hi-Fi Rush,,
menudo truñazo el juego este xd,Hi-Fi Rush,,
pe pe pero mil planetas y y pantallas de carga,Hi-Fi Rush,,
la verdadera carta de amor a los superheroes,Hi-Fi Rush,,
nmms vandal todavía no sale y ya estás haciendo vtalv,Hi-Fi Rush,,
al fin un combatiente digno para pelear para el goty contra zelda god,Hi-Fi Rush,,
en definitiva goty 2023,Hi-Fi Rush,,
me espero al remaster,Hi-Fi Rush,,
haaaa me siento como en casa en esta canal hermanos,Hi-Fi Rush,,
nada pues goty,Hi-Fi Rush,,
a href https www youtube com watch v zf2rd1t5bk amp t 6m39s 6 39 a empieza lo bueno,Hi-Fi Rush,,
tremendos exagerados jkjajkhajkja,Hi-Fi Rush,,
25 horas para platinarlo,Hi-Fi Rush,,
no puede ser como pudo caer tan bajo insomniac de sacar obras maestras en vez de juegos mediocres,Hi-Fi Rush,,
yo jugue el 1 nose este pero a ese juego no era mas de un 8 y algo estaba bien pero sin mas aqui veo mas de lo mismo con algunos agregados le viven inflando notas por ser sony,Hi-Fi Rush,,
como me kgan los títulos donde ponen merece la pena br pf que pdnjos se ven jaja,Hi-Fi Rush,,
no he jugado spiderman desde web of shadows de xbox 360 pero si este está en ps4 igual y le doy una oportunidad cool,Hi-Fi Rush,,
peleas intensas y desafiantes cuando en el gameplay nisiquiera lo tocan y tiene toda la vida llena jajaja,Hi-Fi Rush,,
muy buen juego este nuevo espiderman 2 aunque un poco continuista,Hi-Fi Rush,,
que lo saquen pa pc no,Hi-Fi Rush,,
carlos analiza los mejores juegos de la revista no falla pinta a goty,Hi-Fi Rush,,
piter parker traje black hizo mini trastradores 4 i le inyecta en el traje de miles morales para salvarlo y uno a gata black felicia q hizo portales es ella inteligente usa inteligencia arficial y creo portales y park er le instaló mini rastrador y uno a mery ye para cuidarla saber y uno al dr lagarto q es su amigo y le puso rastrador lla q este le enseñó esto y es antagonista sal va a parker le cono ce su pensamiento cuando venon y cazador van a matarlo lagarto le da colazo sal va a parker y lagarto recuerda q le salbo de duende q le matase con tóxico y ele tricidad piter le salbo por eso lagarto pasa jugando con piter parker black no le mata son los protagonistas 6000 calidad fresca aki en 2024 la difru to más cálida fresca,Hi-Fi Rush,,
alchile es un 8 o 8 5,Hi-Fi Rush,,
a href https www youtube com watch v zf2rd1t5bk amp t 6m38s 6 38 a vaya cachondeo el bicho 30 segundos seguidos recibiendo golpes y el comunicador dice que son peleas intensas y desafiantes,Hi-Fi Rush,,
ol,Hi-Fi Rush,,
black cat robo un artefacto del doctor strange,Hi-Fi Rush,,
is that spider man or raiden,Hi-Fi Rush,,
sin más un juego divertido que puede merecer la pena pero que en pocos años caerá en el olvido,Hi-Fi Rush,,
soy yo o se ve peor que él miles morales y el original,Hi-Fi Rush,,
oww se ve bonito,Hi-Fi Rush,,
25 horas que a mi me costarán 70 jajaja br gracias por el análisis carlos me han entrado muchas ganas de jugarlo tenía mis dudas pero viendo la pasión con la que hablas de él creo que voy a tardar poco en caer en sus redes,Hi-Fi Rush,,
qué coño son quot ezpis quot o algo así,Hi-Fi Rush,,
que ganas de fumarme este juego,Hi-Fi Rush,,
un 9 3 queeeeeeee no os lo creéis ni vosotros eso es lo que se tenía que llevar un juego el doble de grande y mucho menos repetitivo como es starfield sin verguenzas peseteros de sony,Hi-Fi Rush,,
pero bueno no os olvidéis que activision es ahora propiedad de microsoft jeje,Hi-Fi Rush,,
en un juego de sony fua es de lo mejor no tiene nada malo juego de xbox está bien pero tiene muchos bugs no va a 60 frames dais asco,Hi-Fi Rush,,
prensa sonyer,Hi-Fi Rush,,
mucho fanboy de xbox como me parto de risa y mas sabiendo que su super exclusivo es un bodrio bloqueado a 30 fps y no pasa del 83,Hi-Fi Rush,,
no quiero ver nada aporque no me quiero spoilear pero se que vale la pena lo tengo reservado desde que se podía reservar,Hi-Fi Rush,,
en mi opinión decir que es el mejor juego de la historia de spiderman no es mojarse,Hi-Fi Rush,,
lo de los aros cuando planeas eso se puede ocultar,Hi-Fi Rush,,
quot alarañas quot ay estos españoles,Hi-Fi Rush,,
si se dan cuenta este video es full 1nutil no aporta nada y solo habla de cosas obvias jaja lo vemos por las ansias que tenemos,Hi-Fi Rush,,
mucho hyipe por tener el juego ya,Hi-Fi Rush,,
y yo que no me he terminado ninguno porque se me hace repetitivo,Hi-Fi Rush,,
muy tarde esre video ya lo reserve hace una semana xd,Hi-Fi Rush,,
mmmm nose no me convence este juego todavia sigo viendo mucho del anterior que jugué y si me pones al lado el batman arkham city comparando el vuelo no veo algo distintivo y el hecho que le quitaron el modo sigilo me parece negativo por que era algo que ayudaba a bajar el ritmo del juego y no se convirtiera en machaca botones veo un juego igual a lo que fue zelda tears of the kimgdom un juego con un gran dlc como mucho por los aspectos positivos realmente llegaria a un 8 5 como su antecesor cuando se lanzó,Hi-Fi Rush,,
no se si soy yo pero mucho hud pero es comprensible por las nuevas mecanicas de juego pero se siento como si me fuera a perder,Hi-Fi Rush,,
goty,Hi-Fi Rush,,
la gente se preocupa por lo de solo 25 horas para el platino pero yo por ejemplo al primer spider man le eche casi 200 horas sin aburrirme,Hi-Fi Rush,,
joder macho con el tipico comentario de quot no busca reinventar nada quot que necesitais vosotros,Hi-Fi Rush,,
sony y spider man mejor es halo y xbox,Hi-Fi Rush,,
pintaza imsomniac es un de los estudios del momento muchas ganas de ver qué están preparando con wolverine,Hi-Fi Rush,,
deberian de encargarse de alguna saga de iron man,Hi-Fi Rush,,
ajjajaja son los mejores vendiendo su anitol basuras vándalos,Hi-Fi Rush,,
a href https www youtube com watch v zf2rd1t5bk amp t 6m40s 6 40 a si habéis querido ejemplificar en imágenes lo que estáis diciendo no habéis podido coger imágenes mas desacertadas br decís una cosa y mostráis completamente lo opuesto,Hi-Fi Rush,,
lo mismo de siempre cagada de juego,Hi-Fi Rush,,
tengo que decir algo antes de ver el vídeo y espero que alguien me responda cómo cojones van a opinar si vale la pena el juego si no a salido no se supone que salía el 21 tengo entendido,Hi-Fi Rush,,
me hace gracia esta gente que dicen que es continuista normal que quieres que sea un shooter parecéis retrasados en vandal y los haters de xbox luego al zelda que era mega continuista le poneis 10 ainsss,Hi-Fi Rush,,
chau starfield,Hi-Fi Rush,,
resumen si vale la pena,Hi-Fi Rush,,
solo decir muchas gracias sony esto parece películas soy fanático del spiderman ps5 esta on fire,Hi-Fi Rush,,
vamos a ver cómo sony se las apaña para lo que se le viene con un solo juego,Hi-Fi Rush,,
el juego ultra corto parece dlc y a 80 napos xd,Hi-Fi Rush,,
hubiera sido un juegazo con unreal 5,Hi-Fi Rush,,
primer dia de rrseñas y ya tiene mas de 100 notas en metacritic no como otros estudios que solo le dan copia del juego a las páginas que llevan una x en su nombre,Hi-Fi Rush,,
hombre normal es un dlc como no va a tener la misma movilidad xd,Hi-Fi Rush,,
que buena pelicula v,Hi-Fi Rush,,
una pregunta y por qué no salió para ps4,Hi-Fi Rush,,
amo zelda totk pero este spiderman 2 pinta a goty br br rip xbox,Hi-Fi Rush,,
a ver gente es una secuela obviamente no van a innovar como es el segundo juego pues a mí me parece bien ya que el primero es un juegazo eso si una nueva entrega ya tendría que ser mucho más revolucionaria para que merezca la pena,Hi-Fi Rush,,
goty,Hi-Fi Rush,,
me da verg enza que pongan quot merece la pena quot que falta de respeto están de coña,Hi-Fi Rush,,
le están dando unas notas increíbles de todas partes a disfrutar de este juegazo gente y ni caso a lo que digan los tóxicos de siempre,Hi-Fi Rush,,
juegazo no me interesaba conseguirlo pero ahora viéndolo creo que en navidad me compraré este y el sonic superstars probé el mario wonder y se me hizo aburridísimo,Hi-Fi Rush,,
comenta si tienes ps4 y tienes confianza en que salga para ps4,Hi-Fi Rush,,
tirándole flores a sony vandal,Hi-Fi Rush,,
te hacen una carga invisble que es ponerte la pantalla en negro pero eh si lo hace starfield mal como se os ve el plumero piperos peleas desafiantes que no se trata de repetir un patron y se ve a spiderman simbionte dando el mismo combo de puñetazos contra el lagarto una y otra vez no nos engañemos es un buen juego pero siendo el mismo juego que el anterior eso deberia restar puntos luego nos quejamos de que son iguales los assasin creed los fifa,Hi-Fi Rush,,
me gusta spiderman pero el cinismo de esta gente es bestial casi me ofende br seamos sinceros sigue siendo spiderman puedo ver con claridad que algo raro pasa y me ofende que subestimen mi inteligencia,Hi-Fi Rush,,
esto es un dlc que no nos engañen que nos digan la verdad,Hi-Fi Rush,,
39 spidersaludos me gustó tu video de la gran novedad que se tiene sobre marvel spider man 2,Hi-Fi Rush,,
spidergotyman 2,Hi-Fi Rush,,
dios mio amigo porque la gente es tan toxica coño que esto es una secuela esperen a jugar el juego no se guíen solo por una review de algo que ni mostraron completamente esto no es una nueva ip sigue la linea con su antiguo predecesor el spider man 1 y es un juego de spider man hay gente que lo alaba demás si hay gente que espera a ver el juego y criticarlo pq si solo pq le arde las opiniones de la gente que lo alaba demás ignoralos y ya no te dediques a hacer la misma mierda e incluso peor esta comunidad esta condenada zelda totk es tan dlc que te lo pasas yendo al grano en unas 50 horas el spider man lo platinas en 25 pero es que la percepción del tiempo se altera en los juegos haces pausa para comer ir al baño etc no estás pegado las 24 horas eso es solo no cuidar el dlc es diferente pero claro eso solo lo dice la gente toxica que no ha estado en la industria esto se lleva haciendo con las secuelas desde la ness pero claro estas personas apenas y son de esta generación de consolas jajajaj en serio que comunidad más mierda espero disfruten el juego los que lo juegan y no la gente que solo ve opiniones ajenas de vídeos o otras cosas buen día a todos bg3 o zelda totk mi candidato a goty jsjsj y tal vez el spider man cuando lo juegue,Hi-Fi Rush,,
jajajaja es increible la cantidad de ardor que hay entre los xboxers no importa que tengan a bethesda y activision siempre tienen envidia de lo que hay en las demas consolas,Hi-Fi Rush,,
que gracioso como alaban a repetitividad en este juego mientras a otros lo tunden por eso a href https www youtube com watch v zf2rd1t5bk amp t 6m38s 6 38 a quot el plato fuerte del juego son los jefes con combates intensos y desafieantes donde nos obligan a usar el entorno a nuestro favor quot ni siquiera se movió del sitio se quedó en el mismo lugar pulsando un botón sin sufrir daño o estaba en modo fácil,Hi-Fi Rush,,
si lo compro en la playstation store ya deja jugar,Hi-Fi Rush,,
bueno en mi opinión en el primer juego si me aburrieron esas misiones secundarias dónde debes encontrar varias cosas como las mochilas y atrapar las palomas y este juego es un meh ya que regresa eso solo que atrapando robots ahora,Hi-Fi Rush,,
buahhh los gráficos me decepcionaron se ven casi igual que en ps4,Hi-Fi Rush,,
sabes si este tiene tiempo dinámico o es como el primero que no pasaba el tiempo,Hi-Fi Rush,,
primer dia de reseñas y ya tiene mas de 100 reseñas distintas en metacritic cuando un estudio confia en su videojuego se nota no como bethesta que le da las copias de reseña nomas a 20 paginas para que tenga nota alta de salida,Hi-Fi Rush,,
le pintan un 9 2 a otro dlc de los dos primeros increíble,Hi-Fi Rush,,
pero que le pasa a esta página a leguas se ve que es un juego casi perfecto el primer y real nex gen y le pone esa nota,Hi-Fi Rush,,
increíble lo que argumenta de los bosses mientras enseña un combate en el que el boss solo se dedica a recibir golpes xd,Hi-Fi Rush,,
es una broma no,Hi-Fi Rush,,
joder macho que lastima lo del bubniak ver a ese peter tan bien hecho en esta historia hubiese sido increíble jamas sentí tanta empatia con un peter parker este niño no identifica con nada,Hi-Fi Rush,,
los gamers estamos de enhorabuena que nunca nos falten obras maestras como este juego,Hi-Fi Rush,,
dice que si vale la pena br la pregunta ofende vandal,Hi-Fi Rush,,
like numero 932,Hi-Fi Rush,,
la verdad tiene mas pinta de dlc que de juego completo yo veo lo mismo de siempre,Hi-Fi Rush,,
lo único del análisis es lo dr las misiones secundarias todos absolutamente todos los juegos se repiten unos más que otros obviamente pero en ragnarok lo único que diferenciaba las misiones secundarias en la narrativa de resto es igual ir del punto a al b y combatir pero en algunos juegos los que hacen el análisis en todos estos canales se victimizan de las misiones secundarias,Hi-Fi Rush,,
lastima que juego en pc pero espero que saquen pronto la version para pc porque la ps5 esta mas cara que el pingo,Hi-Fi Rush,,
menuda nota más hinchada ni de broma es un juego de 9,Hi-Fi Rush,,
jajajajaja solo con los juegos de sony todo es bueno que risa como dicen que es continuista pero dicen que lo perfecciona jajajsjsjsja que no se note lo comprado que están está gente muy bonito el spiderman pero de un 80 no pasa se roban la mecánica de planeo de batman el estilo de pelea y la manera de hacer las misiones pero bueno así estamos en estos tiempos,Hi-Fi Rush,,
ojalá en un futuro hagan un dlc o un título para spider gwen pedir ya un spider verse sería demasiado,Hi-Fi Rush,,
pero si es el mismo juego tercera parte con otra historia claro faltaría más jajajajajajajja te tienes que reír con la panda del moco esta donde siempre lo tenéis,Hi-Fi Rush,,
le doctore young no tengo mas que decir asco woke,Hi-Fi Rush,,
creo que al fan de xbox no le va a gustar este video,Hi-Fi Rush,,
lo veo muy muy similar al primer spiderman con otras mecanicas pero me da igual porque el primero era y sigue siendo bestial y eso ya es mucho para disfrutar con la siguiente aventura,Hi-Fi Rush,,
era necesario dejar tanto tiempo la persecucion de black cat me hiciste ahí tremendo spoiler bueno al menos no fue tanto spoiler comparado a otros medios qué empiezan con 3d que apenas vi 3 minutos y adiós jaja,Hi-Fi Rush,,
repito de nuevo el simbionten venom es bueno repito,Hi-Fi Rush,,
no veas como se nota que es de nueva generacion menos malllllllllllllllllllllllll por dios,Hi-Fi Rush,,
esta de más ese título,Hi-Fi Rush,,
una verguenza parece un dlc no mas,Hi-Fi Rush,,
a href https www youtube com watch v zf2rd1t5bk amp t 6m40s 6 40 a lo que dices se contradice con lo que aparece en pantalla esa pelea contra el lagarto se ve pesima nisiquiera ataca devuelta,Hi-Fi Rush,,
xd,Hi-Fi Rush,,
los que decian que totk era un dlc donde estan un 9 3 le ponen vaya fandom de pagina,Hi-Fi Rush,,
considero a el merece la pena en el título como algo retórico una pregunta a ese estilo sí debe ser eso efectivamente,Hi-Fi Rush,,
en el título no tendría que poner merece la pena o no tendría que poner es un 10 el juego,Hi-Fi Rush,,
no,Hi-Fi Rush,,
goty 2023 este juego esta a punto de cambiar la humanidad y trascendencia a la historia del gaming como siempre solo en playstation,Hi-Fi Rush,,
alguien reservo el juego el game,Hi-Fi Rush,,
vandal tengo una pregunta se ve peor en el video o es q el juego se ve asi me refiero a los gráficos es q tengo el miedo de q se vea mal,Hi-Fi Rush,,
ni compras ni flautas aquí está el espíritu de los videojuegos los que pueden disfrutar de juegos como éste son los que ganan,Hi-Fi Rush,,
juegazo no veo las horas de poder jugarlo saludos cordiales desde argentina,Hi-Fi Rush,,
pueden hacer tambien la reseña del juego pero para ps4,Hi-Fi Rush,,
que lindos se ven esos 60 fps en ps5 ya de la espectacularidad del juego ni hablemos el que es usuario sabe y conoce la calidad de los gotys de playstation otro aaa que quitan el hipo junto con ratchet ragnarok forbiden west demon souls remake tlou parte 1 y final fantasy 16 esta gen para los jugadores,Hi-Fi Rush,,
me dices que sale en ps4 y me lo creo es un juegazo eso está claro pero yo me esperaba ver ese salto que demuestre que por fin ya está la nueva generación y que esté sería lo que fué quot uncharted 4 quot en 2016 en ps4 a tres años de la generación pero con spider man 2 en este caso y en ese aspecto no lo he visto y eso que lo he visto a 1080p y 60 fps y me sigue pareciendo un juego de ps4 más que de ps5 br a estas alturas pienso que no hay nada que no pueda mover una ps4 con sus recortes perfectamente esta nueva generación pienso que ha salido demasiado pronto y que el hecho de que sigan saliendo juegos en ps4 refuerza el hecho de que ps5 y xbox series no dejan de ser quot consolas vitaminadas quot de ps4 pro y xbox one x quizás sobre 2025 si que veamos los juegos de verdad next gen pero por el momento es un jarro de agua fría en mi opinión,Hi-Fi Rush,,
un triple a que otra vez juega sobre seguro un sistema de sigilo facil y obsoleto y misiones secundarias nuevamente repetitivas y obsoletas resultado demosle un 93 la prensa cuando sale un juego de sony le importa un bledo las cosas negativas jaja,Hi-Fi Rush,,
eso de gracias a las posibilidades de ps5 es relleno q no aporta a la prosa ac mirage es mejor sin duda y se valora menos,Hi-Fi Rush,,
en serio hay alguien que se cree la nota a esta altura era sabido que lo sobrevalorarian como hacen con todos los exclusivos de sony,Hi-Fi Rush,,
se viene la chupadera de pitó a papi geystation,Hi-Fi Rush,,
gran reseña,Hi-Fi Rush,,
jajajaja literal dijeron nos da igual que sea identico a los otros dos juegos mientras que de starfiel dijeron que repetía lo mismo de skyrim y por ello lo hacía monótono y repetitivo así o más comprados,Hi-Fi Rush,,
juego meco de 11 horas,Hi-Fi Rush,,
se viene el goty 23,Hi-Fi Rush,,
patrones en los bosses literal vi que peter le dio 50 golpes a lagarto y el solo los recibió y en esos 50 golpes el lagarto dio 4 golpes osea wtf,Hi-Fi Rush,,
se puede stremear ya el juego,Hi-Fi Rush,,
deci algo mas de venom para eso vinimos,Hi-Fi Rush,,
goty,Hi-Fi Rush,,
épico,Hi-Fi Rush,,
,Hi-Fi Rush,,
tengo la play pero no el juego 39 39 v,Hi-Fi Rush,,
goty,Hi-Fi Rush,,
fuerte dlc,Hi-Fi Rush,,
pero como no va a merecer la pena,Hi-Fi Rush,,
he jugado los dos en la play 5 porque cambiaron el juego ya no es lo que era no me gusta es súper aburrido prefiero los god of war antiguos,Hi-Fi Rush,,
esas voces chistosas en el doblaje españolete,Hi-Fi Rush,,
hola chicos perdón por poner esto aquí no conozco nadie de mi entorno que también tenga la consola tengo el código que me vino con la consola y no quiero el juego si alguien le interesa que me escriba gracias no lo vendo al mismo precio al que está en la store eso por supuesto,Hi-Fi Rush,,
que penoso es el doblaje de españa no le llega ni a la punta al de latinoamericana,Hi-Fi Rush,,
los últimos 2 juegos no merecen el nombre de god of war piensan que ponen mundo abierto a todos y los hacen buenos,Hi-Fi Rush,,
la historia es bastante pobre y muy diluida tiene buenos momentos pero no termina siendo más que un ascension,Hi-Fi Rush,,
a mi me gusto el juego en sí pero el sistema de combate en específico la cámara es asqueroso es tedioso dios el sistema de combate de horizont es mejor,Hi-Fi Rush,,
vamos a comenzarlo ahora mismo y eso que no he jugado absolutamente a ninguno y encima con música de bear mccready,Hi-Fi Rush,,
alguien sabe si es necesario haber jugado al de 2018 para poder disfrutar este,Hi-Fi Rush,,
kratos sienpre quiso a su familia fue por ares que kratos los mató engañado en una ilusión y es por eso que desata toda la furia con los diosos pero siempre tuvo sentimientos,Hi-Fi Rush,,
si papu no spoiler en ragnarok,Hi-Fi Rush,,
compré este juego y la verdad reconozco que ganó elden ring y bien merecido,Hi-Fi Rush,,
no comprendo como no fue el goty,Hi-Fi Rush,,
