textDisplay,videojuego,moderationStatus,sentimiento
cómo q 9 3 yo le pondría infinito 10 esto es una obra maestra a href https www youtube com watch v zf2rd1t5bk amp t 10m49s 10 49 a,Marvel's Spider-Man 2,,
miles morales 2,Marvel's Spider-Man 2,,
un juego con mejores mecánicas ciudad habilidades etc pero siento que a pesar de tener a misterio venom lizard etc no llega a la altura del primero me encantó harry osborn lo adoró este si se me hizo amigo de verdad de peter y no como en las pelis o series la historia hasta la muerte de kraven perfecta pero la parte de venom se veia muy forzada y sin apenas desarrollo aparte de corta,Marvel's Spider-Man 2,,
no está el audio en español si en el uno si ke estaba,Marvel's Spider-Man 2,,
un juego buenísimo par los incondicionales del trepamuros,Marvel's Spider-Man 2,,
ya lo temeiné y es un juegazo completamente,Marvel's Spider-Man 2,,
spiderman 2,Marvel's Spider-Man 2,,
faltan los 30 detalles,Marvel's Spider-Man 2,,
es lo mismo de siempre pero con nueva historia una mecánica nueva y con lenguaje inclusivo y con black cat bi,Marvel's Spider-Man 2,,
vaya la noticia es que miles morales será el spiderman del futuro un n e g ro como protagonista q raro si al final disney todos serán de color,Marvel's Spider-Man 2,,
quería preguntar el modo de dificultad mas bajo como es veréis es para una persona con problemas de salud que no puede jugar una dificultad estandar sería una gran ilusión que pudiera balancearse con spiderman,Marvel's Spider-Man 2,,
porque solo muy poca gente nombra algo muy importante a destacar y que no se nombra br br tiene lenguaje inclusivo br br me encantó el 1 y el de miles pero este no lo compro ni de coña,Marvel's Spider-Man 2,,
ya no hacen los 30 detalles alucinantes,Marvel's Spider-Man 2,,
este videos le doy 5 ostias y un cardenal,Marvel's Spider-Man 2,,
no se porque a muchos les molesta que miles haya sido el mvp del juego esta siguiendo los pasos de su mentor y tiene mas potencial que el,Marvel's Spider-Man 2,,
no mas misiones con mary jane gracias,Marvel's Spider-Man 2,,
ojalá spider man 3 no tenga basura woke,Marvel's Spider-Man 2,,
a href https www youtube com watch v zf2rd1t5bk amp t 9m54s 9 54 a parece que a los medios les indicaron que mencionaras que este juego era quot el mejor juego de superheroes quot es demasiada coincidencia que muchos medios mencionen esta frase en sus reseñas,Marvel's Spider-Man 2,,
este juego es una verdadera carta de amor para los fans de los superhéroes,Marvel's Spider-Man 2,,
reslizar combos magicos con un botón,Marvel's Spider-Man 2,,
o la la,Marvel's Spider-Man 2,,
pobre spiderman sony esta arruinando al personaje,Marvel's Spider-Man 2,,
grandes blanqueando los juegos de mierda x dinero,Marvel's Spider-Man 2,,
me encante el juegue,Marvel's Spider-Man 2,,
después de ver el ultimo video de squadron 42 me da la sensación que spiderman 2 tiene unos gráficos cutres y obsoletos br y a esto le llaman nueva generación jejeje,Marvel's Spider-Man 2,,
señore es un juegazo si el primero te gustó este te va mmar,Marvel's Spider-Man 2,,
a href https www youtube com watch v zf2rd1t5bk amp t 6m39s 6 39 a no podías haber grabado un gameplay donde no sólo spamearas un solo ataque o acaso así es el combate,Marvel's Spider-Man 2,,
tiene lenguaje inclusivo en español genial entonces no pienso comprarlo por bueno que digan que es,Marvel's Spider-Man 2,,
merece la pena si quieres ver una gran cantidad de bugs,Marvel's Spider-Man 2,,
soy usuario de nintendo y xbox pero soy también fan de spiderman desde pequeño jugue el 1 en pc aunque lo de meterle lengueje inclusivo manda pelotas ridículo a mas no poder aun asi disfrutadlo mucho ya era hora de que metieran a venom,Marvel's Spider-Man 2,,
dicen que el juego no tiene para jugar nueva partida y tiene muchos bugs,Marvel's Spider-Man 2,,
flojete,Marvel's Spider-Man 2,,
esto no vale 80 lo siento como mucho 50,Marvel's Spider-Man 2,,
por juegos asi es que play station esta donde esta,Marvel's Spider-Man 2,,
vaya juégazo insomniac se ha sacado el rabo otra vez increíble,Marvel's Spider-Man 2,,
pregunta se puede cambiar el traje negro al rojo como en spiderman web of shadow o si o si tenes que entrar a trajes y cambiarlo manualmente,Marvel's Spider-Man 2,,
spiderbug2 br el inclusive dlc pelijuego de 7 horas q corre a 40 fps para todos aquellos q exigen jugar solo nextgen a 80 napos,Marvel's Spider-Man 2,,
no merece la pena muchos bugs xd tenido que reiniciar en una partida varios puntos para poder avanzar basura de juego,Marvel's Spider-Man 2,,
sí que merece la pena lo malo es que insomniac tiene una fea costumbre os la diré y veréis como en todos sus juegos pasa lo mismo br buenos gráficos buena jugabilidad pero para jugar toma cómete este tutorial esta cinemática esta misión que tienes que hacer sí o sí dos veces y cuando acabes de postre tienes dos misiones repetitivas que duran más de lo que deberían,Marvel's Spider-Man 2,,
cuándo váis a hacer el vídeo quot 30 bugs divertidos de spiderman 2 segundo dlc quot los bugs que tiene os da para una serie completa pero un vídeo creo que es suficiente,Marvel's Spider-Man 2,,
cuando vais a hacer los 30 detalles del nuevo spiderman br tengo muchas ganas,Marvel's Spider-Man 2,,
sería excelente si no lo hubieran contaminado con su nefasta propaganda progresista,Marvel's Spider-Man 2,,
podria salir en ps4,Marvel's Spider-Man 2,,
una pregunta si compro la version deluxe en una cuenta y juego al spiderman en otra podre usar lo que le da la version deluxe en otra cuenta,Marvel's Spider-Man 2,,
hoy día hacen los juegos para tontos que pintan todas esas grúas en la bahía de manthatan recuerdo lo difícil que era llegar en el 2 de ps2 a la estatua de la libertad y hoy día te lo dan todo mascado,Marvel's Spider-Man 2,,
muy superior el mundo abierto de spiderman a la porquería de starfield 1000 planetas sobrios mehhh más de lo mismo xd,Marvel's Spider-Man 2,,
que mal que tenga el lenguaje exclusivo pero nada que hacerle voy a tener que jugarlo,Marvel's Spider-Man 2,,
esparare un par de meses a que baje a mitad de precio,Marvel's Spider-Man 2,,
insomniac va a inaugurar el universo de marvel videojueguil con spiderman wolverine ya veremos que hay en el futuro,Marvel's Spider-Man 2,,
excelente analisis pongame 2 juegos para llevar mi buen hombre,Marvel's Spider-Man 2,,
el calvo esta echando espuma por la boca jajajajaja,Marvel's Spider-Man 2,,
nocedicepizzataguercedicepizzatower,Marvel's Spider-Man 2,,
los bugs están divertidísimos pero hubieran retrasado el lanzamiento para pulir esos detalles una lástima,Marvel's Spider-Man 2,,
nota merecida,Marvel's Spider-Man 2,,
playstation 6 la videoconsola sale en el año 2028 ir ahorrando dinero,Marvel's Spider-Man 2,,
no me mola muy plasticada,Marvel's Spider-Man 2,,
la moda absurda de hoy en día que cada vez que se dice sale sida de decir spaiderman en lugar de spiderman,Marvel's Spider-Man 2,,
más de lo mismo aquel que no va al día con el mundo de los videojuegos podría confundir este título con el primero por momentos y ya estoy viendo a los niños ratas con poco pensamiento crítico no zabez nada de bidejuegozz no niñato jamás dije que fuera malo lo voy a jugar y seguramente lo voy a disfrutar pero eso no le quita lo que ya dije es más de lo mismo,Marvel's Spider-Man 2,,
tremendo pelijuego,Marvel's Spider-Man 2,,
como carajo tiene menos nota que mario wonder,Marvel's Spider-Man 2,,
insomniac está que se sale aprende ubisoft,Marvel's Spider-Man 2,,
hola,Marvel's Spider-Man 2,,
los sonyers fumándose las ideas de una feminista progre enhorabuena por jugar a tal mierda inclusiva yo disfrutaré del mario wonder sin ideas políticas de pedos,Marvel's Spider-Man 2,,
yo espero que el sentido arácnido respeten que cuando te toque enfrentarte a venon que peter parker no detecte a venon mientras que miles molares sí ya que recordemos que peter parker al tener el primero el simbionte el simbionte aprende a anular el sentido arácnido de peter al menos en los comics y dibujos animados de spiderman,Marvel's Spider-Man 2,,
juego para gays,Marvel's Spider-Man 2,,
que lastima lo del sigilo yo esperaba que la mejoren al estilo arkham es el punto flojo de la jugabilidad,Marvel's Spider-Man 2,,
harry es venom y alfinal no matais a golpes entre peter y miles pero es una cinematica de 5 minutos para pedirte que pulse alfinal l2 y cuadrado y tu tienes el poder del antivenom igual que venom pero en blanco vamos,Marvel's Spider-Man 2,,
todo bien le periodistes,Marvel's Spider-Man 2,,
y el hombre de pero,Marvel's Spider-Man 2,,
cuando se podrá canjear el código del juego que viene en la consola no deja,Marvel's Spider-Man 2,,
cuando se podrá canjear el código del juego que viene en la consola no deja,Marvel's Spider-Man 2,,
quot el mejore videojuege de súpere héroes quot br br es una mierda el juego,Marvel's Spider-Man 2,,
cómo es que tú ya lo puedes jugar,Marvel's Spider-Man 2,,
b 15 horas jajajajaja b,Marvel's Spider-Man 2,,
a href https www youtube com watch v zf2rd1t5bk amp t 10m44s 10 44 a,Marvel's Spider-Man 2,,
el que juega es manquisimo como es eso posible,Marvel's Spider-Man 2,,
si merece la pena es el mejor juego del año su historia es brutal el zelda si q tiene un rival muy duro porq ambos son buenos pero spiderman me gusta más,Marvel's Spider-Man 2,,
el viernes me lanzo a la tienda por spiderman 2,Marvel's Spider-Man 2,,
me gusto la parte donde señala a le doctore xd,Marvel's Spider-Man 2,,
rayos sinceramente pensé que en duración iba a ser lo doble del primer juego no de 17 a 25 horas,Marvel's Spider-Man 2,,
amigo llevaba años esperando algún youtuber nuevo que haga los videos con la calidad y dedicación que le pones 10 10 amigo,Marvel's Spider-Man 2,,
no entiendo como a la gente le puede gustar spiderman el juego literlamente dmc devil may cry 3 le gana y eso que salio hace bastante tiempo los juegos de spiderman son una pija,Marvel's Spider-Man 2,,
es lo rico de tener una ps5 y una pc se disfruta de todo sin quejarse,Marvel's Spider-Man 2,,
que lo saquen para pc,Marvel's Spider-Man 2,,
hay más enemigos aparte de los enemigos de kraven porque noto que estamos chetaisimos,Marvel's Spider-Man 2,,
toda la prensa comprada,Marvel's Spider-Man 2,,
a href https www youtube com watch v zf2rd1t5bk amp t 3m39s 3 39 a genial volvio el perk de quot veneno residual quot si añadieron quot sensores de amenaza quot quot malla de inducción quot y quot impulso de venom quot entonces voy a estar demasiado roto usando a miles morales,Marvel's Spider-Man 2,,
basura de juego play station esta muerta y ustedes lo sabeis,Marvel's Spider-Man 2,,
habeis dicho lo de que es el mejor juego de superheroes de la historia br la premisa de sony era la misma para videos y prensa escrita br br animo que vienen las vacas flacas,Marvel's Spider-Man 2,,
juegazo,Marvel's Spider-Man 2,,
esta grabado en nivel facil no lo digo por el combate con el lagarto que se ve demasiado easy,Marvel's Spider-Man 2,,
bueno siendo coherente con el 5 8 de starfield este es un 2 2,Marvel's Spider-Man 2,,
entonces ya a salido,Marvel's Spider-Man 2,,
hack amp slash generico simplon corto y woke hasta el vomito br todo lo que puede dar sony hasta dentro de dos años br calamidad total,Marvel's Spider-Man 2,,
batallas brillantes vs jefes br se carga al lagarto solo con combos xd,Marvel's Spider-Man 2,,
se ve tan hermoso como el primer juego el miles morales nunca sucedió y no me gusta que haya tantos iconos en pantalla sin importar el juego que sea,Marvel's Spider-Man 2,,
menudo truñazo el juego este xd,Marvel's Spider-Man 2,,
pe pe pero mil planetas y y pantallas de carga,Marvel's Spider-Man 2,,
la verdadera carta de amor a los superheroes,Marvel's Spider-Man 2,,
nmms vandal todavía no sale y ya estás haciendo vtalv,Marvel's Spider-Man 2,,
al fin un combatiente digno para pelear para el goty contra zelda god,Marvel's Spider-Man 2,,
en definitiva goty 2023,Marvel's Spider-Man 2,,
me espero al remaster,Marvel's Spider-Man 2,,
haaaa me siento como en casa en esta canal hermanos,Marvel's Spider-Man 2,,
nada pues goty,Marvel's Spider-Man 2,,
a href https www youtube com watch v zf2rd1t5bk amp t 6m39s 6 39 a empieza lo bueno,Marvel's Spider-Man 2,,
tremendos exagerados jkjajkhajkja,Marvel's Spider-Man 2,,
25 horas para platinarlo,Marvel's Spider-Man 2,,
no puede ser como pudo caer tan bajo insomniac de sacar obras maestras en vez de juegos mediocres,Marvel's Spider-Man 2,,
yo jugue el 1 nose este pero a ese juego no era mas de un 8 y algo estaba bien pero sin mas aqui veo mas de lo mismo con algunos agregados le viven inflando notas por ser sony,Marvel's Spider-Man 2,,
como me kgan los títulos donde ponen merece la pena br pf que pdnjos se ven jaja,Marvel's Spider-Man 2,,
no he jugado spiderman desde web of shadows de xbox 360 pero si este está en ps4 igual y le doy una oportunidad cool,Marvel's Spider-Man 2,,
peleas intensas y desafiantes cuando en el gameplay nisiquiera lo tocan y tiene toda la vida llena jajaja,Marvel's Spider-Man 2,,
muy buen juego este nuevo espiderman 2 aunque un poco continuista,Marvel's Spider-Man 2,,
que lo saquen pa pc no,Marvel's Spider-Man 2,,
carlos analiza los mejores juegos de la revista no falla pinta a goty,Marvel's Spider-Man 2,,
piter parker traje black hizo mini trastradores 4 i le inyecta en el traje de miles morales para salvarlo y uno a gata black felicia q hizo portales es ella inteligente usa inteligencia arficial y creo portales y park er le instaló mini rastrador y uno a mery ye para cuidarla saber y uno al dr lagarto q es su amigo y le puso rastrador lla q este le enseñó esto y es antagonista sal va a parker le cono ce su pensamiento cuando venon y cazador van a matarlo lagarto le da colazo sal va a parker y lagarto recuerda q le salbo de duende q le matase con tóxico y ele tricidad piter le salbo por eso lagarto pasa jugando con piter parker black no le mata son los protagonistas 6000 calidad fresca aki en 2024 la difru to más cálida fresca,Marvel's Spider-Man 2,,
alchile es un 8 o 8 5,Marvel's Spider-Man 2,,
a href https www youtube com watch v zf2rd1t5bk amp t 6m38s 6 38 a vaya cachondeo el bicho 30 segundos seguidos recibiendo golpes y el comunicador dice que son peleas intensas y desafiantes,Marvel's Spider-Man 2,,
ol,Marvel's Spider-Man 2,,
black cat robo un artefacto del doctor strange,Marvel's Spider-Man 2,,
is that spider man or raiden,Marvel's Spider-Man 2,,
sin más un juego divertido que puede merecer la pena pero que en pocos años caerá en el olvido,Marvel's Spider-Man 2,,
soy yo o se ve peor que él miles morales y el original,Marvel's Spider-Man 2,,
oww se ve bonito,Marvel's Spider-Man 2,,
25 horas que a mi me costarán 70 jajaja br gracias por el análisis carlos me han entrado muchas ganas de jugarlo tenía mis dudas pero viendo la pasión con la que hablas de él creo que voy a tardar poco en caer en sus redes,Marvel's Spider-Man 2,,
qué coño son quot ezpis quot o algo así,Marvel's Spider-Man 2,,
que ganas de fumarme este juego,Marvel's Spider-Man 2,,
un 9 3 queeeeeeee no os lo creéis ni vosotros eso es lo que se tenía que llevar un juego el doble de grande y mucho menos repetitivo como es starfield sin verguenzas peseteros de sony,Marvel's Spider-Man 2,,
pero bueno no os olvidéis que activision es ahora propiedad de microsoft jeje,Marvel's Spider-Man 2,,
en un juego de sony fua es de lo mejor no tiene nada malo juego de xbox está bien pero tiene muchos bugs no va a 60 frames dais asco,Marvel's Spider-Man 2,,
prensa sonyer,Marvel's Spider-Man 2,,
mucho fanboy de xbox como me parto de risa y mas sabiendo que su super exclusivo es un bodrio bloqueado a 30 fps y no pasa del 83,Marvel's Spider-Man 2,,
no quiero ver nada aporque no me quiero spoilear pero se que vale la pena lo tengo reservado desde que se podía reservar,Marvel's Spider-Man 2,,
en mi opinión decir que es el mejor juego de la historia de spiderman no es mojarse,Marvel's Spider-Man 2,,
lo de los aros cuando planeas eso se puede ocultar,Marvel's Spider-Man 2,,
quot alarañas quot ay estos españoles,Marvel's Spider-Man 2,,
si se dan cuenta este video es full 1nutil no aporta nada y solo habla de cosas obvias jaja lo vemos por las ansias que tenemos,Marvel's Spider-Man 2,,
mucho hyipe por tener el juego ya,Marvel's Spider-Man 2,,
y yo que no me he terminado ninguno porque se me hace repetitivo,Marvel's Spider-Man 2,,
muy tarde esre video ya lo reserve hace una semana xd,Marvel's Spider-Man 2,,
mmmm nose no me convence este juego todavia sigo viendo mucho del anterior que jugué y si me pones al lado el batman arkham city comparando el vuelo no veo algo distintivo y el hecho que le quitaron el modo sigilo me parece negativo por que era algo que ayudaba a bajar el ritmo del juego y no se convirtiera en machaca botones veo un juego igual a lo que fue zelda tears of the kimgdom un juego con un gran dlc como mucho por los aspectos positivos realmente llegaria a un 8 5 como su antecesor cuando se lanzó,Marvel's Spider-Man 2,,
no se si soy yo pero mucho hud pero es comprensible por las nuevas mecanicas de juego pero se siento como si me fuera a perder,Marvel's Spider-Man 2,,
goty,Marvel's Spider-Man 2,,
la gente se preocupa por lo de solo 25 horas para el platino pero yo por ejemplo al primer spider man le eche casi 200 horas sin aburrirme,Marvel's Spider-Man 2,,
joder macho con el tipico comentario de quot no busca reinventar nada quot que necesitais vosotros,Marvel's Spider-Man 2,,
sony y spider man mejor es halo y xbox,Marvel's Spider-Man 2,,
pintaza imsomniac es un de los estudios del momento muchas ganas de ver qué están preparando con wolverine,Marvel's Spider-Man 2,,
deberian de encargarse de alguna saga de iron man,Marvel's Spider-Man 2,,
ajjajaja son los mejores vendiendo su anitol basuras vándalos,Marvel's Spider-Man 2,,
a href https www youtube com watch v zf2rd1t5bk amp t 6m40s 6 40 a si habéis querido ejemplificar en imágenes lo que estáis diciendo no habéis podido coger imágenes mas desacertadas br decís una cosa y mostráis completamente lo opuesto,Marvel's Spider-Man 2,,
lo mismo de siempre cagada de juego,Marvel's Spider-Man 2,,
tengo que decir algo antes de ver el vídeo y espero que alguien me responda cómo cojones van a opinar si vale la pena el juego si no a salido no se supone que salía el 21 tengo entendido,Marvel's Spider-Man 2,,
me hace gracia esta gente que dicen que es continuista normal que quieres que sea un shooter parecéis retrasados en vandal y los haters de xbox luego al zelda que era mega continuista le poneis 10 ainsss,Marvel's Spider-Man 2,,
chau starfield,Marvel's Spider-Man 2,,
resumen si vale la pena,Marvel's Spider-Man 2,,
solo decir muchas gracias sony esto parece películas soy fanático del spiderman ps5 esta on fire,Marvel's Spider-Man 2,,
vamos a ver cómo sony se las apaña para lo que se le viene con un solo juego,Marvel's Spider-Man 2,,
el juego ultra corto parece dlc y a 80 napos xd,Marvel's Spider-Man 2,,
hubiera sido un juegazo con unreal 5,Marvel's Spider-Man 2,,
primer dia de rrseñas y ya tiene mas de 100 notas en metacritic no como otros estudios que solo le dan copia del juego a las páginas que llevan una x en su nombre,Marvel's Spider-Man 2,,
hombre normal es un dlc como no va a tener la misma movilidad xd,Marvel's Spider-Man 2,,
que buena pelicula v,Marvel's Spider-Man 2,,
una pregunta y por qué no salió para ps4,Marvel's Spider-Man 2,,
amo zelda totk pero este spiderman 2 pinta a goty br br rip xbox,Marvel's Spider-Man 2,,
a ver gente es una secuela obviamente no van a innovar como es el segundo juego pues a mí me parece bien ya que el primero es un juegazo eso si una nueva entrega ya tendría que ser mucho más revolucionaria para que merezca la pena,Marvel's Spider-Man 2,,
goty,Marvel's Spider-Man 2,,
me da verg enza que pongan quot merece la pena quot que falta de respeto están de coña,Marvel's Spider-Man 2,,
le están dando unas notas increíbles de todas partes a disfrutar de este juegazo gente y ni caso a lo que digan los tóxicos de siempre,Marvel's Spider-Man 2,,
juegazo no me interesaba conseguirlo pero ahora viéndolo creo que en navidad me compraré este y el sonic superstars probé el mario wonder y se me hizo aburridísimo,Marvel's Spider-Man 2,,
comenta si tienes ps4 y tienes confianza en que salga para ps4,Marvel's Spider-Man 2,,
tirándole flores a sony vandal,Marvel's Spider-Man 2,,
te hacen una carga invisble que es ponerte la pantalla en negro pero eh si lo hace starfield mal como se os ve el plumero piperos peleas desafiantes que no se trata de repetir un patron y se ve a spiderman simbionte dando el mismo combo de puñetazos contra el lagarto una y otra vez no nos engañemos es un buen juego pero siendo el mismo juego que el anterior eso deberia restar puntos luego nos quejamos de que son iguales los assasin creed los fifa,Marvel's Spider-Man 2,,
me gusta spiderman pero el cinismo de esta gente es bestial casi me ofende br seamos sinceros sigue siendo spiderman puedo ver con claridad que algo raro pasa y me ofende que subestimen mi inteligencia,Marvel's Spider-Man 2,,
esto es un dlc que no nos engañen que nos digan la verdad,Marvel's Spider-Man 2,,
39 spidersaludos me gustó tu video de la gran novedad que se tiene sobre marvel spider man 2,Marvel's Spider-Man 2,,
spidergotyman 2,Marvel's Spider-Man 2,,
dios mio amigo porque la gente es tan toxica coño que esto es una secuela esperen a jugar el juego no se guíen solo por una review de algo que ni mostraron completamente esto no es una nueva ip sigue la linea con su antiguo predecesor el spider man 1 y es un juego de spider man hay gente que lo alaba demás si hay gente que espera a ver el juego y criticarlo pq si solo pq le arde las opiniones de la gente que lo alaba demás ignoralos y ya no te dediques a hacer la misma mierda e incluso peor esta comunidad esta condenada zelda totk es tan dlc que te lo pasas yendo al grano en unas 50 horas el spider man lo platinas en 25 pero es que la percepción del tiempo se altera en los juegos haces pausa para comer ir al baño etc no estás pegado las 24 horas eso es solo no cuidar el dlc es diferente pero claro eso solo lo dice la gente toxica que no ha estado en la industria esto se lleva haciendo con las secuelas desde la ness pero claro estas personas apenas y son de esta generación de consolas jajajaj en serio que comunidad más mierda espero disfruten el juego los que lo juegan y no la gente que solo ve opiniones ajenas de vídeos o otras cosas buen día a todos bg3 o zelda totk mi candidato a goty jsjsj y tal vez el spider man cuando lo juegue,Marvel's Spider-Man 2,,
jajajaja es increible la cantidad de ardor que hay entre los xboxers no importa que tengan a bethesda y activision siempre tienen envidia de lo que hay en las demas consolas,Marvel's Spider-Man 2,,
que gracioso como alaban a repetitividad en este juego mientras a otros lo tunden por eso a href https www youtube com watch v zf2rd1t5bk amp t 6m38s 6 38 a quot el plato fuerte del juego son los jefes con combates intensos y desafieantes donde nos obligan a usar el entorno a nuestro favor quot ni siquiera se movió del sitio se quedó en el mismo lugar pulsando un botón sin sufrir daño o estaba en modo fácil,Marvel's Spider-Man 2,,
si lo compro en la playstation store ya deja jugar,Marvel's Spider-Man 2,,
bueno en mi opinión en el primer juego si me aburrieron esas misiones secundarias dónde debes encontrar varias cosas como las mochilas y atrapar las palomas y este juego es un meh ya que regresa eso solo que atrapando robots ahora,Marvel's Spider-Man 2,,
buahhh los gráficos me decepcionaron se ven casi igual que en ps4,Marvel's Spider-Man 2,,
sabes si este tiene tiempo dinámico o es como el primero que no pasaba el tiempo,Marvel's Spider-Man 2,,
primer dia de reseñas y ya tiene mas de 100 reseñas distintas en metacritic cuando un estudio confia en su videojuego se nota no como bethesta que le da las copias de reseña nomas a 20 paginas para que tenga nota alta de salida,Marvel's Spider-Man 2,,
le pintan un 9 2 a otro dlc de los dos primeros increíble,Marvel's Spider-Man 2,,
pero que le pasa a esta página a leguas se ve que es un juego casi perfecto el primer y real nex gen y le pone esa nota,Marvel's Spider-Man 2,,
increíble lo que argumenta de los bosses mientras enseña un combate en el que el boss solo se dedica a recibir golpes xd,Marvel's Spider-Man 2,,
es una broma no,Marvel's Spider-Man 2,,
joder macho que lastima lo del bubniak ver a ese peter tan bien hecho en esta historia hubiese sido increíble jamas sentí tanta empatia con un peter parker este niño no identifica con nada,Marvel's Spider-Man 2,,
los gamers estamos de enhorabuena que nunca nos falten obras maestras como este juego,Marvel's Spider-Man 2,,
dice que si vale la pena br la pregunta ofende vandal,Marvel's Spider-Man 2,,
like numero 932,Marvel's Spider-Man 2,,
la verdad tiene mas pinta de dlc que de juego completo yo veo lo mismo de siempre,Marvel's Spider-Man 2,,
lo único del análisis es lo dr las misiones secundarias todos absolutamente todos los juegos se repiten unos más que otros obviamente pero en ragnarok lo único que diferenciaba las misiones secundarias en la narrativa de resto es igual ir del punto a al b y combatir pero en algunos juegos los que hacen el análisis en todos estos canales se victimizan de las misiones secundarias,Marvel's Spider-Man 2,,
lastima que juego en pc pero espero que saquen pronto la version para pc porque la ps5 esta mas cara que el pingo,Marvel's Spider-Man 2,,
menuda nota más hinchada ni de broma es un juego de 9,Marvel's Spider-Man 2,,
